{
  "version": "2.3.5",
  "dsl_version": "1.0.0",
  "authoritative": true,
  "execution_model": "deterministic_rule_dsl",
  "workflow": [
    "integrity_check",
    "preprocess_evidence",
    "compute_dimension_metrics",
    "evaluate_dimension_outcomes",
    "evaluate_evidence_sufficiency",
    "derive_manual_review_flags",
    "evaluate_downgrade_consistency",
    "calculate_score",
    "aggregate_result"
  ],
  "integrity_check": {
    "required_record_fields": [
      "task_id",
      "name",
      "address",
      "x_coord",
      "y_coord",
      "poi_type",
      "city",
      "poi_status"
    ],
    "required_evidence_fields": [
      "evidence_id",
      "source",
      "data",
      "verification.is_valid",
      "verification.confidence"
    ],
    "minimum_evidence_count": 1,
    "on_failure": {
      "dimension_status": "fail",
      "risk_level": "high",
      "qc_status": "unqualified",
      "qc_score": 0,
      "dimension_impacts": {
        "name": ["name"],
        "x_coord": ["location"],
        "y_coord": ["location"],
        "address": ["address"],
        "city": ["administrative"],
        "poi_type": ["category"],
        "poi_status": ["existence"],
        "task_id": ["existence", "name", "location", "address", "administrative", "category", "evidence_sufficiency", "downgrade_consistency"],
        "evidence_record": ["existence", "name", "location", "address", "administrative", "category", "evidence_sufficiency", "downgrade_consistency"]
      }
    }
  },
  "source_priority_profiles": {
    "default": [
      {
        "match": {
          "source_type": ["business_license", "official_registry", "government", "official_data"]
        },
        "priority": 1,
        "authoritative": true
      },
      {
        "match": {
          "source_type": ["map_data", "map"]
        },
        "priority": 2,
        "authoritative": false
      },
      {
        "match": {
          "source_type": ["platform", "ota", "merchant"]
        },
        "priority": 3,
        "authoritative": false
      },
      {
        "match": {
          "source_type": ["ugc", "review", "unknown"]
        },
        "priority": 4,
        "authoritative": false
      }
    ]
  },
  "normalization_profiles": {
    "name": {
      "steps": [
        "trim",
        "collapse_whitespace",
        "fullwidth_to_halfwidth",
        "lower_ascii",
        "remove_company_suffix",
        "remove_common_branch_suffix"
      ],
      "company_suffix_tokens": ["有限公司", "有限责任公司", "股份有限公司"],
      "branch_suffix_tokens": ["店", "门店", "旗舰店", "分店", "直营店"]
    },
    "address": {
      "steps": [
        "trim",
        "collapse_whitespace",
        "fullwidth_to_halfwidth",
        "remove_punctuation",
        "normalize_chinese_numerals",
        "normalize_building_alias"
      ],
      "ignorable_suffix_tokens": ["室", "层", "楼", "铺位", "号铺"],
      "branch_suffix_tokens": ["店", "门店", "分店", "旗舰店"]
    },
    "administrative": {
      "steps": [
        "trim",
        "collapse_whitespace",
        "remove_admin_suffix"
      ],
      "province_suffix_tokens": ["省", "市", "自治区", "特别行政区"],
      "city_suffix_tokens": ["市", "地区", "盟", "自治州"],
      "district_suffix_tokens": ["区", "县", "旗", "自治县"]
    },
    "category": {
      "steps": [
        "trim",
        "collapse_whitespace",
        "lower_ascii"
      ],
      "path_separator": "/"
    }
  },
  "function_catalog": [
    {
      "name": "count",
      "returns": "number",
      "description": "Count items under selector when condition is true."
    },
    {
      "name": "avg",
      "returns": "number",
      "description": "Average a numeric field under selector when condition is true."
    },
    {
      "name": "max",
      "returns": "number",
      "description": "Maximum numeric field under selector when condition is true."
    },
    {
      "name": "count_match_level",
      "returns": "number",
      "description": "Count items whose custom match function returns one of the configured levels."
    },
    {
      "name": "max_match_level",
      "returns": "string",
      "description": "Return the highest configured match level across all selected items."
    }
  ],
  "derived_fields": {
    "qc_manual_review_required": {
      "type": "boolean",
      "expression": {
        "any": [
          {
            "left": {
              "ref": "dimension.existence.status"
            },
            "op": "ne",
            "right": "pass"
          },
          {
            "left": {
              "ref": "dimension.name.status"
            },
            "op": "ne",
            "right": "pass"
          },
          {
            "left": {
              "ref": "dimension.location.status"
            },
            "op": "ne",
            "right": "pass"
          },
          {
            "left": {
              "ref": "dimension.address.status"
            },
            "op": "ne",
            "right": "pass"
          },
          {
            "left": {
              "ref": "dimension.administrative.status"
            },
            "op": "ne",
            "right": "pass"
          },
          {
            "left": {
              "ref": "dimension.category.status"
            },
            "op": "ne",
            "right": "pass"
          }
        ]
      }
    },
    "upstream_manual_review_signal_source": {
      "type": "string",
      "resolution_order": [
        {
          "name": "verify_result.pass",
          "when": {
            "left": {
              "ref": "verify_result"
            },
            "op": "eq",
            "right": "核实通过"
          },
          "value": "verify_result"
        },
        {
          "name": "verify_result.manual_review_short",
          "when": {
            "left": {
              "ref": "verify_result"
            },
            "op": "eq",
            "right": "需人工核实"
          },
          "value": "verify_result"
        },
        {
          "name": "verify_result.manual_review_long",
          "when": {
            "left": {
              "ref": "verify_result"
            },
            "op": "eq",
            "right": "需要人工核实"
          },
          "value": "verify_result"
        }
      ],
      "default": "verify_result_defaulted_pass"
    },
    "upstream_manual_review_required": {
      "type": "boolean",
      "resolution_order": [
        {
          "name": "verify_result.pass",
          "when": {
            "left": {
              "ref": "verify_result"
            },
            "op": "eq",
            "right": "核实通过"
          },
          "value": false
        },
        {
          "name": "verify_result.manual_review_short",
          "when": {
            "left": {
              "ref": "verify_result"
            },
            "op": "eq",
            "right": "需人工核实"
          },
          "value": true
        },
        {
          "name": "verify_result.manual_review_long",
          "when": {
            "left": {
              "ref": "verify_result"
            },
            "op": "eq",
            "right": "需要人工核实"
          },
          "value": true
        }
      ],
      "default": false
    }
  },
  "dimensions": {
    "existence": {
      "rule_id": "R1",
      "title": "存在性一致性检查",
      "record_selector": "poi_status",
      "evidence_selector": "evidence_record[]",
      "source_priority_profile": "default",
      "evaluation": {
        "order": ["fail", "risk", "pass"],
        "mode": "first_match"
      },
      "metrics": [
        {
          "name": "valid_existence_evidence_count",
          "function": "count",
          "selector": "evidence_record[]",
          "where": {
            "all": [
              {
                "left": {
                  "ref": "evidence.verification.is_valid"
                },
                "op": "eq",
                "right": true
              },
              {
                "any": [
                  {
                    "left": {
                      "ref": "evidence.data.name"
                    },
                    "op": "exists"
                  },
                  {
                    "left": {
                      "ref": "evidence.data.address"
                    },
                    "op": "exists"
                  }
                ]
              }
            ]
          }
        },
        {
          "name": "support_count",
          "function": "count",
          "selector": "evidence_record[]",
          "where": {
            "all": [
              {
                "left": {
                  "ref": "evidence.verification.is_valid"
                },
                "op": "eq",
                "right": true
              },
              {
                "any": [
                  {
                    "left": {
                      "ref": "evidence.data.name"
                    },
                    "op": "exists"
                  },
                  {
                    "left": {
                      "ref": "evidence.data.address"
                    },
                    "op": "exists"
                  }
                ]
              }
            ]
          }
        },
        {
          "name": "high_confidence_support_count",
          "function": "count",
          "selector": "evidence_record[]",
          "where": {
            "all": [
              {
                "left": {
                  "ref": "evidence.verification.is_valid"
                },
                "op": "eq",
                "right": true
              },
              {
                "any": [
                  {
                    "left": {
                      "ref": "evidence.data.name"
                    },
                    "op": "exists"
                  },
                  {
                    "left": {
                      "ref": "evidence.data.address"
                    },
                    "op": "exists"
                  }
                ]